date,review_text,cleaned_review_basic,rating_num,sentiment,review_length_chars,review_length_words,helpful_votes_num,verified_purchase_bool,location,version,platform
########,Cover board discussion film figure short line range. Decision public food court how commercial citizen production for might listen organization indicate risk director enjoy.,cover board discussion film figure short line range decision public food court how commercial citizen production for might listen organization indicate risk director enjoy,3,neutral,173,24,126,FALSE,Albania,2.6.4,Flipkart
########,Area impact position cause lead ever stand dark product eight strategy. Focus so for nice current Democrat me.,area impact position cause lead ever stand dark product eight strategy focus so for nice current democrat me,3,neutral,110,18,123,TRUE,Slovakia (Slovak Republic),3.3.7,Google Play
06-05-2025,Reach training main exactly parent heart big policy everybody hard. Book care seek foot simple including charge character federal customer because.,reach training main exactly parent heart big policy everybody hard book care seek foot simple including charge character federal customer because,4,positive,147,21,27,FALSE,Trinidad and Tobago,1.6.5,Flipkart
########,Whatever guess significant section Democrat fly direction gun current will. Effort section age budget improve how main answer more tree mention.,whatever guess significant section democrat fly direction gun current will effort section age budget improve how main answer more tree mention,3,neutral,144,21,112,FALSE,Montserrat,5.2.4,Amazon
########,Same north wind sister mother sometimes. Off life practice course authority range stand letter.,same north wind sister mother sometimes off life practice course authority range stand letter,5,positive,95,14,177,FALSE,Montserrat,3.2.6,Flipkart
########,Perhaps hope across follow character talk. Purpose force leader program show off great they test check significant deal consider ago own suddenly.,perhaps hope across follow character talk purpose force leader program show off great they test check significant deal consider ago own suddenly,3,neutral,146,22,188,FALSE,Central African Republic,2.5.6,App Store
########,Do turn sign agree there want but way agent. Herself land human day herself sport behavior compare tree right.,do turn sign agree there want but way agent herself land human day herself sport behavior compare tree right,4,positive,110,19,93,TRUE,Comoros,2.9.8,Google Play
########,Son growth effort born lead account sound. Which beyond growth finally assume watch present director red practice special then administration.,son growth effort born lead account sound which beyond growth finally assume watch present director red practice special then administration,5,positive,142,20,6,FALSE,Puerto Rico,4.4.1,App Store
########,Article sort term produce he increase. Information company million character speak protect half understand skill.,article sort term produce he increase information company million character speak protect half understand skill,4,positive,113,15,35,FALSE,Greenland,3.2.6,Amazon
01-09-2024,Alone the trial another help out modern citizen address today begin write. Why less indeed together key tax speak a.,alone the trial another help out modern citizen address today begin write why less indeed together key tax speak a,1,negative,116,20,114,FALSE,Congo,5.6.8,Website
########,Method south central process sea response executive past. Difficult continue process forget wind property mind officer third service.,method south central process sea response executive past difficult continue process forget wind property mind officer third service,5,positive,133,18,9,TRUE,Niue,5.1.1,Amazon
########,Woman add play structure down however activity lose. Could thank wife if yeah law enjoy key seat pretty method front.,woman add play structure down however activity lose could thank wife if yeah law enjoy key seat pretty method front,3,neutral,117,20,42,FALSE,Malaysia,5.6.5,Website
########,Site interview agent myself behind window. Build require call girl laugh network vote whom.,site interview agent myself behind window build require call girl laugh network vote whom,1,negative,91,14,2,TRUE,Nepal,2.8.8,Google Play
########,None most another mouth much really young. Hear beyond close plant peace successful seem charge walk.,none most another mouth much really young hear beyond close plant peace successful seem charge walk,4,positive,101,16,95,FALSE,Saint Helena,5.8.2,App Store
########,A edge new find type party where arrive improve. Lose civil will with within hospital city industry option.,a edge new find type party where arrive improve lose civil will with within hospital city industry option,1,negative,107,18,123,TRUE,Peru,4.1.1,Google Play
########,Kitchen public set action bring find bill pick. Discussion just state must particular child they senior result themselves we American study eight.,kitchen public set action bring find bill pick discussion just state must particular child they senior result themselves we american study eight,3,neutral,146,22,79,FALSE,Italy,2.8.7,Amazon
04-06-2024,Tend exactly right every edge meet information. Work bar big south drug manager opportunity program billion sit remain.,tend exactly right every edge meet information work bar big south drug manager opportunity program billion sit remain,4,positive,119,18,24,TRUE,Serbia,3.1.4,App Store
########,Oil remember page spring responsibility always positive key leave tell. Vote spend physical sing protect agent note.,oil remember page spring responsibility always positive key leave tell vote spend physical sing protect agent note,1,negative,116,17,5,TRUE,Korea,2.3.8,Amazon
########,Grow raise good whole everybody situation foot recognize play. Decide side natural focus husband give spring suddenly task.,grow raise good whole everybody situation foot recognize play decide side natural focus husband give spring suddenly task,5,positive,123,18,40,FALSE,Luxembourg,4.7.3,Amazon
########,Series dark task magazine front just guess city. Follow born ok training record night series Mrs huge.,series dark task magazine front just guess city follow born ok training record night series mrs huge,2,negative,102,17,47,FALSE,Saint Barthelemy,1.9.3,App Store
########,Government card history suddenly save theory sometimes party wife food different step. Nature property event manager street work early difficult possible democratic.,government card history suddenly save theory sometimes party wife food different step nature property event manager street work early difficult possible democratic,5,positive,165,22,109,TRUE,Micronesia,2.3.4,App Store
########,Court control million hundred offer total hit end someone hair soon issue hair. Floor ground when care team worry east Mrs can wonder.,court control million hundred offer total hit end someone hair soon issue hair floor ground when care team worry east mrs can wonder,5,positive,134,23,26,FALSE,Austria,3.5.3,Website
########,Just opportunity ask yet against large practice time live relationship as great western. Now water road require make region wall worry Democrat laugh Mrs.,just opportunity ask yet against large practice time live relationship as great western now water road require make region wall worry democrat laugh mrs,1,negative,154,24,67,FALSE,Rwanda,3.9.6,App Store
03-07-2024,Onto simple audience as including claim create woman similar writer. Ahead up rock forward behind idea red rate source.,onto simple audience as including claim create woman similar writer ahead up rock forward behind idea red rate source,5,positive,119,19,29,FALSE,Iran,4.9.2,Amazon
########,Goal positive bank later behind election these article. Arrive health collection white more above his agree toward nor teacher western country per consider.,goal positive bank later behind election these article arrive health collection white more above his agree toward nor teacher western country per consider,5,positive,156,23,151,FALSE,Turkmenistan,3.1.3,Google Play
