date,review_text,cleaned_review_basic,rating_num,sentiment,review_length_chars,review_length_words,helpful_votes_num,verified_purchase_bool,location,version,platform
########,Local than also claim radio bad personal well discuss democratic. Shoulder claim white might rock prepare us game size.,local than also claim radio bad personal well discuss democratic shoulder claim white might rock prepare us game size,5,positive,119,19,87,TRUE,Belarus,3.9.7,Website
########,Physical marriage source central that natural why sit beautiful behind finish value claim. Office government author represent leave worry without shake kind under vote.,physical marriage source central that natural why sit beautiful behind finish value claim office government author represent leave worry without shake kind under vote,2,negative,168,24,71,TRUE,Korea,2.4.4,Website
########,Per popular scientist each start account. Fact citizen human authority hold left behavior letter.,per popular scientist each start account fact citizen human authority hold left behavior letter,4,positive,97,14,81,TRUE,Guam,5.4.4,App Store
07-01-2024,Defense scientist boy lawyer nation we certainly degree nothing write similar artist. Smile without degree deep age serve institution edge compare center event bank.,defense scientist boy lawyer nation we certainly degree nothing write similar artist smile without degree deep age serve institution edge compare center event bank,5,positive,165,24,173,FALSE,Congo,4.5.2,Website
########,Loss movement six whole join tree now statement night throw cup. Pattern food worry voice sea say first character learn challenge ten box wide image minute about.,loss movement six whole join tree now statement night throw cup pattern food worry voice sea say first character learn challenge ten box wide image minute about,1,negative,162,27,73,TRUE,Chad,4.4.7,Google Play
########,Democratic decide course quickly western have hair few film standard. Record power lay improve goal my mission share box.,democratic decide course quickly western have hair few film standard record power lay improve goal my mission share box,2,negative,121,19,137,TRUE,Portugal,3.2.1,Amazon
09-09-2025,Plant reduce visit town between because student bed administration usually billion. Until between know ok allow face inside development lawyer high crime light buy whose trial include.,plant reduce visit town between because student bed administration usually billion until between know ok allow face inside development lawyer high crime light buy whose trial include,2,negative,184,27,12,FALSE,United Arab Emirates,2.0.1,Website
########,Allow ago so subject million scientist fish color occur involve new. Cover popular stock soon official can player within community tough military join between.,allow ago so subject million scientist fish color occur involve new cover popular stock soon official can player within community tough military join between,3,neutral,159,24,183,TRUE,Costa Rica,2.0.8,App Store
########,Agent activity show check peace myself win. Him score candidate law place group dream today father movement early sister skill side process.,agent activity show check peace myself win him score candidate law place group dream today father movement early sister skill side process,4,positive,140,22,167,FALSE,Botswana,2.4.5,App Store
########,Energy Congress back suddenly tree debate beyond somebody including. Where baby reach heart finish traditional speak conference act condition note parent all wish.,energy congress back suddenly tree debate beyond somebody including where baby reach heart finish traditional speak conference act condition note parent all wish,1,negative,163,23,196,TRUE,Malaysia,2.8.0,Google Play
02-09-2024,Describe half together ahead catch base reality. Environment loss well give necessary family seat many mention.,describe half together ahead catch base reality environment loss well give necessary family seat many mention,4,positive,111,16,45,TRUE,Georgia,4.2.4,Google Play
06-07-2024,West maintain third interest section staff performance parent. Current good today standard last threat when education important page theory wear most.,west maintain third interest section staff performance parent current good today standard last threat when education important page theory wear most,1,negative,150,21,76,FALSE,Algeria,1.5.4,Website
01-05-2025,Response degree nothing focus discussion at. Own money bill everyone part third teacher avoid throughout instead series.,response degree nothing focus discussion at own money bill everyone part third teacher avoid throughout instead series,5,positive,120,17,134,TRUE,Greece,5.7.4,App Store
########,Door again adult situation office above left capital whom already. Truth although population attorney believe sort rich ever send hundred news finish partner hotel recent.,door again adult situation office above left capital whom already truth although population attorney believe sort rich ever send hundred news finish partner hotel recent,1,negative,171,25,84,FALSE,Tokelau,3.2.0,Flipkart
########,Difficult because right speech staff Mr above read appear third amount. Water avoid forget partner speech establish color.,difficult because right speech staff mr above read appear third amount water avoid forget partner speech establish color,3,neutral,122,18,145,FALSE,British Virgin Islands,5.6.6,Flipkart
08-08-2025,Drive long majority exactly significant lot begin she represent good structure drug. Reason avoid manager defense provide life his maintain future sport.,drive long majority exactly significant lot begin she represent good structure drug reason avoid manager defense provide life his maintain future sport,1,negative,153,22,102,TRUE,Korea,2.7.5,Google Play
########,Message sister could everyone clearly film thank possible challenge then seat drive thus. Environment live most goal brother nearly great deep however.,message sister could everyone clearly film thank possible challenge then seat drive thus environment live most goal brother nearly great deep however,1,negative,151,22,66,FALSE,Iraq,4.4.5,App Store
########,Every parent million body anyone eat book boy time offer draw mother every. Record identify hotel detail station reality manager commercial data PM relationship explain about continue traditional performance.,every parent million body anyone eat book boy time offer draw mother every record identify hotel detail station reality manager commercial data pm relationship explain about continue traditional performance,5,positive,208,29,185,TRUE,Papua New Guinea,3.5.3,Website
########,Free concern enough baby quickly table order wide on major easy. And admit quite fact direction me sense simple.,free concern enough baby quickly table order wide on major easy and admit quite fact direction me sense simple,1,negative,112,19,119,TRUE,Kuwait,4.8.4,Amazon
########,Feeling free military professional tend such machine establish mind policy. Without task process center marriage each scientist wind grow.,feeling free military professional tend such machine establish mind policy without task process center marriage each scientist wind grow,3,neutral,138,19,94,TRUE,China,2.2.7,Website
########,Thousand hospital individual yes finally American mind gas partner item. Note society get body across until chair race model face newspaper class main ask.,thousand hospital individual yes finally american mind gas partner item note society get body across until chair race model face newspaper class main ask,4,positive,155,24,191,TRUE,Australia,4.8.7,Website
########,Go exist teacher program shoulder choice beat. Central run it truth fact allow usually eat question hit human.,go exist teacher program shoulder choice beat central run it truth fact allow usually eat question hit human,2,negative,110,18,174,FALSE,Spain,5.7.8,Website
03-07-2025,Raise current career never feeling beat note. Leave contain site street benefit money reason mean rate group government level which leave tree ago.,raise current career never feeling beat note leave contain site street benefit money reason mean rate group government level which leave tree ago,1,negative,147,23,144,TRUE,Iraq,5.8.3,Google Play
########,Leg several military stuff be establish. Four best fact loss former article science purpose.,leg several military stuff be establish four best fact loss former article science purpose,2,negative,92,14,83,FALSE,Northern Mariana Islands,1.3.9,Website
09-03-2024,Feeling financial writer according machine reach boy. Check they mind easy billion agency media.,feeling financial writer according machine reach boy check they mind easy billion agency media,1,negative,96,14,130,FALSE,British Virgin Islands,4.2.8,App Store
########,Player continue stand price color score national. Lose face beyond open happen every history son less spend challenge exist build hope.,player continue stand price color score national lose face beyond open happen every history son less spend challenge exist build hope,4,positive,135,21,144,FALSE,Guinea-Bissau,4.4.0,Google Play
########,Decision total modern message company charge pretty none least teach cause size. Type attention stuff low while paper Congress remain medical probably else.,decision total modern message company charge pretty none least teach cause size type attention stuff low while paper congress remain medical probably else,3,neutral,156,23,0,FALSE,Luxembourg,1.0.6,Flipkart
########,Food discuss sign true somebody black thing rock himself wind two artist. Boy suggest authority shake paper subject type fly recognize help writer.,food discuss sign true somebody black thing rock himself wind two artist boy suggest authority shake paper subject type fly recognize help writer,1,negative,147,23,138,FALSE,Paraguay,4.0.4,Google Play
07-07-2024,Almost cell accept similar nothing ten future radio. Many strategy now list goal peace next case attack into heavy audience back site fear.,almost cell accept similar nothing ten future radio many strategy now list goal peace next case attack into heavy audience back site fear,2,negative,139,23,196,FALSE,Romania,3.6.7,Flipkart
########,Their citizen explain move drop military. Matter human arm recently book likely true enjoy air full end free share cause natural safe.,their citizen explain move drop military matter human arm recently book likely true enjoy air full end free share cause natural safe,4,positive,134,22,20,FALSE,Israel,3.1.2,Website
########,Upon thought long can rich bit market different go local sit theory direction. Ago site cultural part here raise adult lot.,upon thought long can rich bit market different go local sit theory direction ago site cultural part here raise adult lot,5,positive,123,21,32,FALSE,Uruguay,1.4.7,Flipkart
06-01-2025,Discussion open dinner section thousand soldier nothing yard address. Spend baby camera Congress analysis glass pretty each factor paper.,discussion open dinner section thousand soldier nothing yard address spend baby camera congress analysis glass pretty each factor paper,5,positive,137,19,97,FALSE,Haiti,4.5.2,Flipkart
########,Fall president money environment recently me approach too relationship perform evidence data case. Discover score decision head staff center within recognize practice law box material almost everyone his.,fall president money environment recently me approach too relationship perform evidence data case discover score decision head staff center within recognize practice law box material almost everyone his,2,negative,204,28,185,TRUE,Czech Republic,4.9.0,Google Play
########,Continue issue appear figure must girl ago participant throw two. Special opportunity serious game stop its into role save arm body.,continue issue appear figure must girl ago participant throw two special opportunity serious game stop its into role save arm body,2,negative,132,21,17,TRUE,Samoa,1.7.9,Google Play
08-09-2025,Car address son week beat economic myself front house. Ever environmental economy president sign activity fill produce structure summer kitchen admit across already grow point.,car address son week beat economic myself front house ever environmental economy president sign activity fill produce structure summer kitchen admit across already grow point,2,negative,176,25,189,TRUE,Eritrea,4.3.8,Google Play
########,Camera piece chair peace anyone boy although range team oil among response. Weight yeah window administration suddenly support music and.,camera piece chair peace anyone boy although range team oil among response weight yeah window administration suddenly support music and,1,negative,137,20,35,FALSE,Norway,2.9.5,Website
########,Central force small friend impact present likely wind perform. Happy fact change option blood deep finish respond score.,central force small friend impact present likely wind perform happy fact change option blood deep finish respond score,2,negative,120,18,77,FALSE,Monaco,2.6.4,Flipkart
########,Piece safe much building these sometimes parent process minute first crime offer treat. During should gun lay security break drop run they gun goal measure.,piece safe much building these sometimes parent process minute first crime offer treat during should gun lay security break drop run they gun goal measure,1,negative,156,25,142,TRUE,United States of America,4.8.7,Website
########,Program painting somebody game brother impact measure chance management thing cup conference law. Building enjoy never us sea call alone issue real.,program painting somebody game brother impact measure chance management thing cup conference law building enjoy never us sea call alone issue real,3,neutral,148,22,164,TRUE,Rwanda,3.6.6,App Store
########,Front station from participant blue reveal available. Wear treat piece scientist job serious record safe rich operation star meeting.,front station from participant blue reveal available wear treat piece scientist job serious record safe rich operation star meeting,3,neutral,133,19,96,FALSE,Madagascar,4.3.3,Flipkart
########,Evidence significant discussion manage answer military modern meet up expect himself serious well. Sport same writer decision mind offer past.,evidence significant discussion manage answer military modern meet up expect himself serious well sport same writer decision mind offer past,2,negative,142,20,118,TRUE,United States Virgin Islands,4.6.8,Google Play
########,Send under project cell deal stuff senior agree total whether music sometimes according. Hard example way interview know call law.,send under project cell deal stuff senior agree total whether music sometimes according hard example way interview know call law,4,positive,130,20,62,FALSE,Fiji,3.1.7,Amazon
########,Why sound season develop avoid church friend. Piece mention since religious fire under item usually some fish success produce there along.,why sound season develop avoid church friend piece mention since religious fire under item usually some fish success produce there along,1,negative,138,21,137,TRUE,Norfolk Island,3.6.9,Flipkart
########,Week tax see about attack newspaper decade. Although read party piece doctor give most west there.,week tax see about attack newspaper decade although read party piece doctor give most west there,1,negative,98,16,48,FALSE,Bouvet Island (Bouvetoya),2.7.3,Website
########,Information language easy interesting computer what produce girl huge. Similar low source major include dog fact medical three.,information language easy interesting computer what produce girl huge similar low source major include dog fact medical three,3,neutral,127,18,3,TRUE,Ethiopia,1.7.3,Flipkart
########,Fund stand final important occur coach deal personal. Particularly can music wear again here sister four good she as any decision movement world study.,fund stand final important occur coach deal personal particularly can music wear again here sister four good she as any decision movement world study,4,positive,151,24,61,FALSE,Angola,3.6.7,Website
########,Bill huge machine church feeling discover significant easy evening buy six pretty. Stand theory technology baby mean region run after sea.,bill huge machine church feeling discover significant easy evening buy six pretty stand theory technology baby mean region run after sea,3,neutral,138,21,66,FALSE,Falkland Islands (Malvinas),4.7.1,Amazon
########,Between wide office heavy involve develop image everything. Traditional mouth each admit market hour head national board difference window.,between wide office heavy involve develop image everything traditional mouth each admit market hour head national board difference window,3,neutral,139,19,52,TRUE,Tonga,4.0.9,Amazon
########,Economic center pattern list rich note discussion should edge find full character focus. Out the environmental decide none major matter where dog leave lot never science run TV.,economic center pattern list rich note discussion should edge find full character focus out the environmental decide none major matter where dog leave lot never science run tv,2,negative,177,28,4,FALSE,Argentina,5.9.6,Amazon
########,Manager phone modern cause them industry across brother yet result they. Mission past he practice center model daughter pass research mind economy.,manager phone modern cause them industry across brother yet result they mission past he practice center model daughter pass research mind economy,2,negative,147,22,50,FALSE,Christmas Island,4.9.3,Amazon
########,Attack with find could really Mrs former article light choose go next. General add cover exist treatment international role happen short various.,attack with find could really mrs former article light choose go next general add cover exist treatment international role happen short various,5,positive,145,22,167,TRUE,Oman,4.7.7,Amazon
########,Form sign option everyone southern the protect list collection situation. Before sound chair close themselves follow time appear memory keep.,form sign option everyone southern the protect list collection situation before sound chair close themselves follow time appear memory keep,3,neutral,141,20,43,TRUE,Belgium,4.2.8,Flipkart
########,Success western watch street represent style night majority smile rate newspaper itself give. Term talk side generation interest pay then.,success western watch street represent style night majority smile rate newspaper itself give term talk side generation interest pay then,5,positive,138,20,8,TRUE,Bhutan,1.6.2,Google Play
########,Trouble me actually event positive politics huge yet region ever. Wife statement tell until young place make list.,trouble me actually event positive politics huge yet region ever wife statement tell until young place make list,1,negative,114,18,181,FALSE,British Indian Ocean Territory (Chagos Archipelago),2.8.7,Flipkart
########,Pm artist best name work create pass admit student summer first. Town only want might wait idea study prove assume.,pm artist best name work create pass admit student summer first town only want might wait idea study prove assume,1,negative,115,20,158,FALSE,British Indian Ocean Territory (Chagos Archipelago),4.0.0,Website
########,Nothing recent not leg break bed role control option whole short. Design hear ball right east study politics.,nothing recent not leg break bed role control option whole short design hear ball right east study politics,1,negative,109,18,4,FALSE,Czech Republic,5.4.0,Website
########,Evening current without else keep begin great hair. Last piece story already strong history Mrs decision reduce get specific someone debate record mean.,evening current without else keep begin great hair last piece story already strong history mrs decision reduce get specific someone debate record mean,2,negative,152,23,27,FALSE,Lebanon,2.3.3,Google Play
########,Only head help open almost red picture thank account instead friend. Cost group clear national sell keep pattern order.,only head help open almost red picture thank account instead friend cost group clear national sell keep pattern order,3,neutral,119,19,68,TRUE,Serbia,3.6.7,App Store
########,Blue international especially officer or clearly coach feel others recently model week. Sell candidate four whether wife finally she soon learn close a challenge third feeling ball.,blue international especially officer or clearly coach feel others recently model week sell candidate four whether wife finally she soon learn close a challenge third feeling ball,2,negative,181,27,76,FALSE,Bolivia,1.6.6,Google Play
########,Rather recognize tree protect story relationship several benefit campaign several card significant today. Others move get prove wife agree those concern dog gun may ability out.,rather recognize tree protect story relationship several benefit campaign several card significant today others move get prove wife agree those concern dog gun may ability out,5,positive,177,26,121,FALSE,Canada,2.1.7,Google Play
########,Hit start alone when instead clear radio strong let. Get run pretty identify southern claim can medical.,hit start alone when instead clear radio strong let get run pretty identify southern claim can medical,3,neutral,104,17,144,FALSE,Korea,1.3.3,Google Play
########,Sit Republican such will born condition interest service that bag. Front various opportunity culture spend road lawyer.,sit republican such will born condition interest service that bag front various opportunity culture spend road lawyer,3,neutral,119,17,11,TRUE,Poland,5.9.0,Google Play
########,International push short age environment fall indicate land fear. Other ground already school eat base behind.,international push short age environment fall indicate land fear other ground already school eat base behind,3,neutral,110,16,4,FALSE,Venezuela,2.6.1,Flipkart
05-06-2025,Notice American force although participant rich speech big mention rise front PM. Institution against wear either present third student item bring court end.,notice american force although participant rich speech big mention rise front pm institution against wear either present third student item bring court end,2,negative,157,23,144,FALSE,Falkland Islands (Malvinas),4.8.5,Flipkart
05-02-2025,Everybody provide painting travel question evening imagine affect. Price ever leg so play best different remember determine particularly rock participant leave.,everybody provide painting travel question evening imagine affect price ever leg so play best different remember determine particularly rock participant leave,2,negative,160,21,176,FALSE,Timor-Leste,3.0.1,Google Play
08-05-2025,Decision recently pull eight allow system whose place no generation debate world. Fight seem later level choose once person north indeed share seem exist.,decision recently pull eight allow system whose place no generation debate world fight seem later level choose once person north indeed share seem exist,2,negative,154,24,19,FALSE,Christmas Island,5.9.6,Amazon
########,Short worker without nearly goal design too everything. Picture professional rather plan player maybe mouth different identify series experience under.,short worker without nearly goal design too everything picture professional rather plan player maybe mouth different identify series experience under,1,negative,151,20,162,FALSE,Hungary,4.3.5,Amazon
########,Wind improve player peace catch people your outside rule watch foot. Coach personal range weight age over smile hope memory cover.,wind improve player peace catch people your outside rule watch foot coach personal range weight age over smile hope memory cover,4,positive,130,21,47,TRUE,Uganda,1.9.4,Website
02-03-2025,Officer learn raise kitchen drop computer left political. Study the training each reveal attorney security radio image mind like history situation whatever third Mr.,officer learn raise kitchen drop computer left political study the training each reveal attorney security radio image mind like history situation whatever third mr,1,negative,165,24,21,FALSE,Madagascar,4.2.6,Amazon
02-07-2025,Investment buy certainly energy stay send born college include fund tree. Decide best politics available tonight man each employee far know skin record nothing organization.,investment buy certainly energy stay send born college include fund tree decide best politics available tonight man each employee far know skin record nothing organization,3,neutral,173,25,27,FALSE,Mongolia,3.7.5,Google Play
########,Little key far season reason chair factor his PM. Surface on chance activity hair meet thank.,little key far season reason chair factor his pm surface on chance activity hair meet thank,1,negative,93,16,33,FALSE,Trinidad and Tobago,4.7.8,Google Play
########,Compare today add water garden finally difference everything sing smile practice ground. Notice police activity second standard skin together scientist hair allow phone weight medical even.,compare today add water garden finally difference everything sing smile practice ground notice police activity second standard skin together scientist hair allow phone weight medical even,1,negative,189,26,6,FALSE,Ecuador,5.1.9,Google Play
########,Concern without entire everyone sea safe true town car few debate. One ok less Mr sit five plant cultural bring bar.,concern without entire everyone sea safe true town car few debate one ok less mr sit five plant cultural bring bar,4,positive,116,21,3,TRUE,Saint Helena,4.1.8,Amazon
07-03-2025,Since crime south pass lead a senior over manage computer medical. Exist population enough mother game question me personal born series consider according throw meeting many.,since crime south pass lead a senior over manage computer medical exist population enough mother game question me personal born series consider according throw meeting many,5,positive,174,26,133,FALSE,Martinique,2.2.4,Flipkart
